{
  "schemaVersion": 1,
  "capturedAt": "2026-09-01",
  "purpose": "dsh-plugin-top10-score-authority",
  "status": "candidate-pending",
  "frozen": false,
  "baseline": {
    "tag": "dsh-v0.1.2-alpha.2",
    "commit": "0a53fb55bea101816fa226bb964ae2bed71c343b"
  },
  "candidateIntake": {
    "path": "plugin-candidate-intake.json",
    "sha256": "f85bcf6b72929385bab9adcd252a37c088b1ce8c199d9d7c0f7538054354de09",
    "requiredItemCount": 80
  },
  "scoring": {
    "weights": {
      "userValueAndUseCaseClarity": 25,
      "stabilityMaintenanceAndAlpha2Fit": 25,
      "securityAndPermissionRestraint": 15,
      "crossPlatformInstallRemoveRollback": 15,
      "nonTechnicalUsabilityAndDocs": 10,
      "combinationComplementarity": 10
    },
    "minimumUseCaseCategories": 8,
    "useCaseCategories": [
      "build-and-review",
      "collaborate-and-notify",
      "discover-and-start",
      "govern-and-secure",
      "measure-and-optimize",
      "navigate-and-focus",
      "plan-and-automate",
      "remember-and-retrieve",
      "research-the-web",
      "see-and-understand"
    ],
    "tieBreakOrder": [
      "stability-plus-security",
      "maintenance-activity",
      "lower-public-id"
    ]
  },
  "pluginSet": {
    "requiredItemCount": 80,
    "verifiedItemCount": 0,
    "itemAuthoritySetSha256": null
  },
  "items": [],
  "scoreAuthorityPayloadSha256": "5ab95ab51133bc637105ff030017dbdfacac27f8d11e4c71a268897959d6e394"
}
